name,profileURL,designation,location
Natasha Mittal,https://www.linkedin.com/in/nmittal29,GHC'19 Scholar | Research Assistant at EdgeLab at UCSC,Santa Cruz, CA
Aditya Kumar,https://www.linkedin.com/in/aditya-kumar-1ba228111,Software Development Engineer I at Amazon,San Diego, CA
Sneha Rudra,https://www.linkedin.com/in/sneha-rudra-8265031a,Software Development Engineer 2 @ Amazon Alexa | IIT Madras | UW Madison,San Francisco Bay Area
Avradeep Bhowmik,https://www.linkedin.com/in/avradeep1,Applied Scientist at Amazon,San Francisco, CA
Rima Mittal,https://www.linkedin.com/in/rimamittal,SDE 2 at Amazon | MSc Analytics, The University of Chicago | Machine Learning - Deep Learning Enthusiast,San Francisco Bay Area
Arnav Vaid,https://www.linkedin.com/in/vaidarnav,Software Engineer at Amazon Key,Santa Clara, CA
Le Ma,https://www.linkedin.com/in/le-ma-803945129,SDE at Amazon Web Services (AWS),San Francisco Bay Area
Aubrey Ji,https://www.linkedin.com/in/yanzhu-ji,Software Engineer at Amazon,Palo Alto, CA
Thomas Francis,https://www.linkedin.com/in/thomas-a-francis,Software Dev @ Amazon | Ex Software Curator @ Tesla | Technology Orator | Coach & Advocate of SE Practices and Agile,Santa Clara, CA
Mehul Ketkar,https://www.linkedin.com/in/mehulketkar,Category Management, Pets at Amazon,San Francisco Bay Areaname,profileURL,designation,location
Gauri Bendre,https://www.linkedin.com/in/gauribendre,Software Development Engineer at Amazon,San Francisco Bay Area
Rou Zhang,https://www.linkedin.com/in/rou-zhang,Software Engineer at Amazon,Los Angeles, CA
Surbhi Anurag Gupta,https://www.linkedin.com/in/surbhi8,Amazon,San Francisco Bay Area
Karan Rampal,https://www.linkedin.com/in/karanrampal,Senior Product Manager - Tech | Amazon - Search | ISB,San Francisco Bay Area
Michael Miles,https://www.linkedin.com/in/michael-miles-05b649,Talent Acquisition at Amazon Web Services (AWS),San Jose, CA
Darius J.,https://www.linkedin.com/in/johnsondarius,Building Things | Incoming Investment Banking Summer Analyst @ Goldman Sachs,San Francisco Bay Area
Julie T,https://www.linkedin.com/in/julie-t-0407451b2,Recruiting Manager at Amazon,San Francisco, CA
Albert Cheng,https://www.linkedin.com/in/alberthcheng,Chief Operating Officer & Co-Head of Television at Amazon Studios,Culver City, CA
linkedin member,https://www.linkedin.com/search/results/people/headless?geoUrn=%5B102095887%5D&currentCompany=%5B1586%2C17411%2C12227%2C49318%2C167364%2C16551%2C14951%2C2649984%2C46825%2C208137%2C34924%2C61712%2C451028%2C47157%2C111446%2C21433%2C2382910%2C71099%2C860467%5D&origin=FACETED_SEARCH,Managing Director at Amazon,Los Angeles Metropolitan Area
Ayushi Singh,https://www.linkedin.com/in/ayushi-singh1511,Software Engineer at Amazon Web Services (AWS),San Francisco Bay Areaname,profileURL,designation,location
Shriya Rao,https://www.linkedin.com/in/shriya-rao-msba,Business Insights & Data Analyst at Amazon Web Services (AWS),Santa Clara, CA
Rajat Shah,https://www.linkedin.com/in/rajatsshah,Sr. Software Engineer at Amazon,San Diego County, CA
Adam Werbach,https://www.linkedin.com/in/werbach,Global Lead, Sustainable Shopping at Amazon,San Francisco, CA
Allie K. Miller,https://www.linkedin.com/in/alliekmiller,Global Head of Machine Learning BD, Startups and Venture Capital at AWS | 1MM+ followers | LinkedIn Top Voice 2019 and 2020,San Francisco Bay Area
linkedin member,https://www.linkedin.com/search/results/people/headless?geoUrn=%5B102095887%5D&currentCompany=%5B1586%2C17411%2C12227%2C49318%2C167364%2C16551%2C14951%2C2649984%2C46825%2C208137%2C34924%2C61712%2C451028%2C47157%2C111446%2C21433%2C2382910%2C71099%2C860467%5D&origin=FACETED_SEARCH,VP/GM at Amazon,Saratoga, CA
Bratin Saha,https://www.linkedin.com/in/bratin-saha-05824b3,Vice President and General Manager at Amazon,San Francisco Bay Area
Rich Geraffo,https://www.linkedin.com/in/richgeraffo,Vice President Americas Sales for Amazon Web Services at Amazon.com (AWS),Morgan Hill, CA
Prashant Nigam,https://www.linkedin.com/in/nigamprashant,Amazon is hiring! Ping me.,Irvine, CA
Prashanth Cecil,https://www.linkedin.com/in/prashanthcecil,Senior Operations Manager at Amazon,Greater Sacramento
Bing Yin,https://www.linkedin.com/in/bingyin,Hiring PhD interns and full time to work on research problems in NLP and Data Mining,Palo Alto, CA